{
  "blocking": false,
  "items": [
    {
      "canonicalDisplayName": "MG Neser",
      "legacyLeadAvailable": false,
      "playerId": "0164b064",
      "playerTeamSeasonIds": [
        "pts:0164b064:ipl-2013:team-kings-xi-punjab"
      ],
      "reviewId": "country-overseas:0164b064",
      "reviewStatus": "PENDING",
      "seasonIds": [
        "ipl-2013"
      ],
      "unresolvedFields": [
        "CRICKET_NATION",
        "IPL_ROSTER_STATUS"
      ]
    },
    {
      "canonicalDisplayName": "Liton Das",
      "legacyLeadAvailable": false,
      "playerId": "0404d43c",
      "playerTeamSeasonIds": [
        "pts:0404d43c:ipl-2023:team-kolkata-knight-riders"
      ],
      "reviewId": "country-overseas:0404d43c",
      "reviewStatus": "PENDING",
      "seasonIds": [
        "ipl-2023"
      ],
      "unresolvedFields": [
        "CRICKET_NATION",
        "IPL_ROSTER_STATUS"
      ]
    },
    {
      "canonicalDisplayName": "SS Mundhe",
      "legacyLeadAvailable": false,
      "playerId": "0af3426f",
      "playerTeamSeasonIds": [
        "pts:0af3426f:ipl-2011:team-pune-warriors"
      ],
      "reviewId": "country-overseas:0af3426f",
      "reviewStatus": "PENDING",
      "seasonIds": [
        "ipl-2011"
      ],
      "unresolvedFields": [
        "CRICKET_NATION",
        "IPL_ROSTER_STATUS"
      ]
    },
    {
      "canonicalDisplayName": "Harmeet Singh",
      "legacyLeadAvailable": false,
      "playerId": "0bf15e52",
      "playerTeamSeasonIds": [
        "pts:0bf15e52:ipl-2013:team-rajasthan-royals"
      ],
      "reviewId": "country-overseas:0bf15e52",
      "reviewStatus": "PENDING",
      "seasonIds": [
        "ipl-2013"
      ],
      "unresolvedFields": [
        "CRICKET_NATION",
        "IPL_ROSTER_STATUS"
      ]
    },
    {
      "canonicalDisplayName": "H Das",
      "legacyLeadAvailable": false,
      "playerId": "0ed0cdbf",
      "playerTeamSeasonIds": [
        "pts:0ed0cdbf:ipl-2008:team-deccan-chargers"
      ],
      "reviewId": "country-overseas:0ed0cdbf",
      "reviewStatus": "PENDING",
      "seasonIds": [
        "ipl-2008"
      ],
      "unresolvedFields": [
        "CRICKET_NATION",
        "IPL_ROSTER_STATUS"
      ]
    },
    {
      "canonicalDisplayName": "Subhransu Senapati",
      "legacyLeadAvailable": false,
      "playerId": "0edcb652",
      "playerTeamSeasonIds": [
        "pts:0edcb652:ipl-2023:team-chennai-super-kings"
      ],
      "reviewId": "country-overseas:0edcb652",
      "reviewStatus": "PENDING",
      "seasonIds": [
        "ipl-2023"
      ],
      "unresolvedFields": [
        "CRICKET_NATION",
        "IPL_ROSTER_STATUS"
      ]
    },
    {
      "canonicalDisplayName": "DM Bravo",
      "legacyLeadAvailable": false,
      "playerId": "14b14cd8",
      "playerTeamSeasonIds": [
        "pts:14b14cd8:ipl-2017:team-kolkata-knight-riders"
      ],
      "reviewId": "country-overseas:14b14cd8",
      "reviewStatus": "PENDING",
      "seasonIds": [
        "ipl-2017"
      ],
      "unresolvedFields": [
        "CRICKET_NATION",
        "IPL_ROSTER_STATUS"
      ]
    },
    {
      "canonicalDisplayName": "AA Kazi",
      "legacyLeadAvailable": false,
      "playerId": "16605a1b",
      "playerTeamSeasonIds": [
        "pts:16605a1b:ipl-2011:team-royal-challengers-bangalore"
      ],
      "reviewId": "country-overseas:16605a1b",
      "reviewStatus": "PENDING",
      "seasonIds": [
        "ipl-2011"
      ],
      "unresolvedFields": [
        "CRICKET_NATION",
        "IPL_ROSTER_STATUS"
      ]
    },
    {
      "canonicalDisplayName": "X Thalaivan Sargunam",
      "legacyLeadAvailable": false,
      "playerId": "1763bc6c",
      "playerTeamSeasonIds": [
        "pts:1763bc6c:ipl-2013:team-sunrisers-hyderabad"
      ],
      "reviewId": "country-overseas:1763bc6c",
      "reviewStatus": "PENDING",
      "seasonIds": [
        "ipl-2013"
      ],
      "unresolvedFields": [
        "CRICKET_NATION",
        "IPL_ROSTER_STATUS"
      ]
    },
    {
      "canonicalDisplayName": "CJ Green",
      "legacyLeadAvailable": false,
      "playerId": "19b9f399",
      "playerTeamSeasonIds": [
        "pts:19b9f399:ipl-2020:team-kolkata-knight-riders"
      ],
      "reviewId": "country-overseas:19b9f399",
      "reviewStatus": "PENDING",
      "seasonIds": [
        "ipl-2020"
      ],
      "unresolvedFields": [
        "CRICKET_NATION",
        "IPL_ROSTER_STATUS"
      ]
    },
    {
      "canonicalDisplayName": "CJ Dala",
      "legacyLeadAvailable": false,
      "playerId": "1cb14aa4",
      "playerTeamSeasonIds": [
        "pts:1cb14aa4:ipl-2018:team-delhi-daredevils"
      ],
      "reviewId": "country-overseas:1cb14aa4",
      "reviewStatus": "PENDING",
      "seasonIds": [
        "ipl-2018"
      ],
      "unresolvedFields": [
        "CRICKET_NATION",
        "IPL_ROSTER_STATUS"
      ]
    },
    {
      "canonicalDisplayName": "RR Bose",
      "legacyLeadAvailable": false,
      "playerId": "21ac077a",
      "playerTeamSeasonIds": [
        "pts:21ac077a:ipl-2009:team-kings-xi-punjab"
      ],
      "reviewId": "country-overseas:21ac077a",
      "reviewStatus": "PENDING",
      "seasonIds": [
        "ipl-2009"
      ],
      "unresolvedFields": [
        "CRICKET_NATION",
        "IPL_ROSTER_STATUS"
      ]
    },
    {
      "canonicalDisplayName": "Jalaj S Saxena",
      "legacyLeadAvailable": false,
      "playerId": "249abedf",
      "playerTeamSeasonIds": [
        "pts:249abedf:ipl-2021:team-punjab-kings"
      ],
      "reviewId": "country-overseas:249abedf",
      "reviewStatus": "PENDING",
      "seasonIds": [
        "ipl-2021"
      ],
      "unresolvedFields": [
        "CRICKET_NATION",
        "IPL_ROSTER_STATUS"
      ]
    },
    {
      "canonicalDisplayName": "A Nel",
      "legacyLeadAvailable": false,
      "playerId": "2503e881",
      "playerTeamSeasonIds": [
        "pts:2503e881:ipl-2008:team-mumbai-indians"
      ],
      "reviewId": "country-overseas:2503e881",
      "reviewStatus": "PENDING",
      "seasonIds": [
        "ipl-2008"
      ],
      "unresolvedFields": [
        "CRICKET_NATION",
        "IPL_ROSTER_STATUS"
      ]
    },
    {
      "canonicalDisplayName": "R Goyal",
      "legacyLeadAvailable": false,
      "playerId": "266849c1",
      "playerTeamSeasonIds": [
        "pts:266849c1:ipl-2023:team-mumbai-indians"
      ],
      "reviewId": "country-overseas:266849c1",
      "reviewStatus": "PENDING",
      "seasonIds": [
        "ipl-2023"
      ],
      "unresolvedFields": [
        "CRICKET_NATION",
        "IPL_ROSTER_STATUS"
      ]
    },
    {
      "canonicalDisplayName": "Mayank Rawat",
      "legacyLeadAvailable": false,
      "playerId": "2b801189",
      "playerTeamSeasonIds": [
        "pts:2b801189:ipl-2026:team-mumbai-indians"
      ],
      "reviewId": "country-overseas:2b801189",
      "reviewStatus": "PENDING",
      "seasonIds": [
        "ipl-2026"
      ],
      "unresolvedFields": [
        "CRICKET_NATION",
        "IPL_ROSTER_STATUS"
      ]
    },
    {
      "canonicalDisplayName": "Mohammad Ashraful",
      "legacyLeadAvailable": false,
      "playerId": "2bb09eb2",
      "playerTeamSeasonIds": [
        "pts:2bb09eb2:ipl-2009:team-mumbai-indians"
      ],
      "reviewId": "country-overseas:2bb09eb2",
      "reviewStatus": "PENDING",
      "seasonIds": [
        "ipl-2009"
      ],
      "unresolvedFields": [
        "CRICKET_NATION",
        "IPL_ROSTER_STATUS"
      ]
    },
    {
      "canonicalDisplayName": "DAJ Bracewell",
      "legacyLeadAvailable": false,
      "playerId": "2e9fdf9b",
      "playerTeamSeasonIds": [
        "pts:2e9fdf9b:ipl-2012:team-delhi-daredevils"
      ],
      "reviewId": "country-overseas:2e9fdf9b",
      "reviewStatus": "PENDING",
      "seasonIds": [
        "ipl-2012"
      ],
      "unresolvedFields": [
        "CRICKET_NATION",
        "IPL_ROSTER_STATUS"
      ]
    },
    {
      "canonicalDisplayName": "C Madan",
      "legacyLeadAvailable": false,
      "playerId": "2eeb4370",
      "playerTeamSeasonIds": [
        "pts:2eeb4370:ipl-2010:team-mumbai-indians"
      ],
      "reviewId": "country-overseas:2eeb4370",
      "reviewStatus": "PENDING",
      "seasonIds": [
        "ipl-2010"
      ],
      "unresolvedFields": [
        "CRICKET_NATION",
        "IPL_ROSTER_STATUS"
      ]
    },
    {
      "canonicalDisplayName": "Younis Khan",
      "legacyLeadAvailable": false,
      "playerId": "33cb3411",
      "playerTeamSeasonIds": [
        "pts:33cb3411:ipl-2008:team-rajasthan-royals"
      ],
      "reviewId": "country-overseas:33cb3411",
      "reviewStatus": "PENDING",
      "seasonIds": [
        "ipl-2008"
      ],
      "unresolvedFields": [
        "CRICKET_NATION",
        "IPL_ROSTER_STATUS"
      ]
    },
    {
      "canonicalDisplayName": "R Sanjay Yadav",
      "legacyLeadAvailable": false,
      "playerId": "33ffc3dd",
      "playerTeamSeasonIds": [
        "pts:33ffc3dd:ipl-2022:team-mumbai-indians"
      ],
      "reviewId": "country-overseas:33ffc3dd",
      "reviewStatus": "PENDING",
      "seasonIds": [
        "ipl-2022"
      ],
      "unresolvedFields": [
        "CRICKET_NATION",
        "IPL_ROSTER_STATUS"
      ]
    },
    {
      "canonicalDisplayName": "MP Breetzke",
      "legacyLeadAvailable": false,
      "playerId": "35f173a0",
      "playerTeamSeasonIds": [
        "pts:35f173a0:ipl-2025:team-lucknow-super-giants"
      ],
      "reviewId": "country-overseas:35f173a0",
      "reviewStatus": "PENDING",
      "seasonIds": [
        "ipl-2025"
      ],
      "unresolvedFields": [
        "CRICKET_NATION",
        "IPL_ROSTER_STATUS"
      ]
    },
    {
      "canonicalDisplayName": "Sediqullah Atal",
      "legacyLeadAvailable": false,
      "playerId": "3c28853f",
      "playerTeamSeasonIds": [
        "pts:3c28853f:ipl-2025:team-delhi-capitals"
      ],
      "reviewId": "country-overseas:3c28853f",
      "reviewStatus": "PENDING",
      "seasonIds": [
        "ipl-2025"
      ],